{
  "schema": "pester-leak-report/v1",
  "schemaVersion": "1.0.0",
  "generatedAt": "2025-10-03T16:59:31.6320850-07:00",
  "targets": [
    "LVCompare",
    "LabVIEW"
  ],
  "graceSeconds": 0.1,
  "waitedMs": 100,
  "procsBefore": [],
  "procsAfter": [],
  "runningJobs": [],
  "allJobs": [],
  "jobsBefore": [],
  "leakDetected": false,
  "actions": [],
  "killedProcs": [],
  "stoppedJobs": [],
  "notes": [
    "Leak = LabVIEW/LVCompare (or configured targets) still running or Pester jobs still active after test run"
  ]
}
